{
  "schemaVersion": "mission-control-acceptance-source-manifest/1",
  "scope": "disposable_consensus_acceptance_security_boundary",
  "sourceBase": "33d4bcd62789f767a7bbe9b1f7588eee4f0f0549",
  "includedRoots": [
    "agents",
    "app",
    "application",
    "db",
    "domain",
    "execution",
    "fixtures",
    "git",
    "integrations",
    "lib",
    "policy",
    "remote-agent",
    "schemas",
    "scripts",
    "templates",
    "tests"
  ],
  "includedFiles": [
    "eslint.config.mjs",
    "instrumentation-node.ts",
    "instrumentation.ts",
    "next-env.d.ts",
    "next.config.ts",
    "package-lock.json",
    "package.json",
    "tsconfig.json"
  ],
  "excludedFiles": ["domain/mission-control-acceptance-source-manifest.json"],
  "files": {
    "agents/hermes/bridge.ts": "54f760a759b1e968f54645fc633d7d3a67a2a9c24a6a9336983131a9cbc45d61",
    "agents/hermes/mission-control-client.ts": "3bd4d3207f773bf684ac82ef2fe34030d72332c89d7b1357cb51b780e6491e94",
    "agents/hermes/run-codex-pricing.ts": "4abf88580a51eb9eeb6dda2289819b5a3dafabbe281ddc8cd4894e2529bbfb1c",
    "app/agent-connect-wizard.tsx": "460c3bc4eeb1cb4c99151f6b0725c01a824a0e5c8e8c71615626e1eb17b450c5",
    "app/agents/[agentId]/credential-controls.tsx": "ca6c306898c58c912152d0d5eadc7fb727783bed159c052a073c2345150c05a1",
    "app/agents/[agentId]/page.tsx": "46fc26c4a225b45963e851307808da26f1e87fc3e9d129ee808477b5e43378aa",
    "app/agents/[agentId]/repository-controls.tsx": "a3661e667881b4d6a6c7fb465b6bdce00fdc1f615ed664256f1dce480cfd4036",
    "app/agents/page.tsx": "555e093e983a8911214cc9d3b3143c7de8c6da60cb3812a1951cb65d38f225a2",
    "app/agents/registry.tsx": "fe4633e8ad6e385e66a1be62c0f8f3bde63148870ada6d8243e3db095f440b09",
    "app/api/actions/[actionRequestId]/reconcile-publication/route.ts": "08c30c8e82821c8b5ff75fc1bc99ce6240c45420594bd218a185d73b604e25b7",
    "app/api/agent-events/route.ts": "a715692254ad36e88b55b0125af3011ee7132fdddf07049775842ffe7698993f",
    "app/api/agent-protocol/v1/assignments/[assignmentId]/acknowledge/route.ts": "9a850761bc028c4ee51241099683ca4b447cbb4001fa3ad53797dd0cb8ae76a3",
    "app/api/agent-protocol/v1/assignments/[assignmentId]/approval/route.ts": "f443d99aac8b7d73cbb5a170c518330d32dca93bcbc5ecfb085e0b173d466766",
    "app/api/agent-protocol/v1/assignments/[assignmentId]/cancellation/route.ts": "43a0ea7204a2a08f4413dcfd15890665b090ce3c5b1c2a424a5cb0d20e67012a",
    "app/api/agent-protocol/v1/assignments/[assignmentId]/lease/route.ts": "03612af34726568b4e8a25a7771d37fdd721058b2e70a1cfa106d9f04cdbfc03",
    "app/api/agent-protocol/v1/assignments/[assignmentId]/release/route.ts": "484dbd74b9d7ada4477945d2fb982175cf8ea46e822c38460f862be08d1171c9",
    "app/api/agent-protocol/v1/assignments/pull/route.ts": "3d7f24c18e89779e79d2ae35039f3d52603a9d7367b606a90b6450db4cfd1ba4",
    "app/api/agent-protocol/v1/messages/route.ts": "4b99f4ca4fccf18e1ce511b5e7760497809f6f2ab7e47ad2a8753a5eefed0dbc",
    "app/api/agent-protocol/v1/project-brain/[assignmentId]/lease/route.ts": "d957008e7285457286044e526f16de63c8a76902c4de3707dd532218bcba9bdb",
    "app/api/agent-protocol/v1/project-brain/[assignmentId]/reauthorize/route.ts": "cb21bb864b0a7812dd84c6058b815c4d22b8da390c4a3e35d9d76c51cc37e927",
    "app/api/agent-protocol/v1/project-brain/messages/route.ts": "aeca3f805672833e216d82155602c8fb6ad95287fc556ca5212b83aeac9cc5a9",
    "app/api/agent-protocol/v1/project-brain/pull/route.ts": "5bb5bf6cb766195fdd8c2556f861ce195df800fa02b127ee11b42f4e471704d3",
    "app/api/agent-protocol/v1/publications/complete/route.ts": "d2c583ca42780b3078252680154ed2f1de74e47c33304dc57cf25a7651c5b6f0",
    "app/api/agent-protocol/v1/publications/fail/route.ts": "d3d8956bdcadccf8b0f68ab59236b50456bbe434f68ce8157754c6f62f9c4a72",
    "app/api/agent-protocol/v1/publications/pull/route.ts": "6904859aed32c26be898e5985b86d994ad8577f2c17311b838610f738acb7bac",
    "app/api/agent-protocol/v1/repositories/identity/acknowledge/route.ts": "4bd7009b88db51f61858f010fae0733eaa0b8761d5ae27e4bf639350f6d6fedb",
    "app/api/agent-protocol/v1/repositories/identity/complete/route.ts": "639e82c0c31d29919ee41364708df75514c9f706aa8b0350e8b7987c7b62aff2",
    "app/api/agent-protocol/v1/repositories/identity/preview/route.ts": "84df788d468e2ac2103b6533f8fd0efa39537d44af1759965d0883b632c25ab8",
    "app/api/agent-protocol/v1/repositories/identity/status/route.ts": "df69bde26c0e96648ad63e38e373bac52e37c964410d9cf65b6040a5979e1397",
    "app/api/agent-protocol/v1/repositories/remove/route.ts": "55f0d28291f1cd9e5cb07257587dabbb5b0804aa48f0cf52830316367e69b079",
    "app/api/agent-protocol/v1/repositories/route.ts": "af0ae2279db77203084c478d4d282410ef1180e2392d1bf1ec6a529158e402fd",
    "app/api/agents/[agentId]/assignments/route.ts": "f5810482cd7854321f96cac40d6642288d075012d218645268416315b316efb0",
    "app/api/agents/[agentId]/credentials/[credentialId]/revoke/route.ts": "f8c24df93e57a7cb69f00863a7523f0f90cb150741e8b4516016855363ee0c07",
    "app/api/agents/[agentId]/credentials/revoke-all/route.ts": "5002eba3b23ba8eeabb967f4a358c0828cfa6fa3e80ee3ca7787999e5d8a524b",
    "app/api/agents/[agentId]/credentials/route.ts": "5c45fa8f8fc8cda52190b8767460a4d4be9acfb78bacf86c1a554fbef0c381c8",
    "app/api/agents/[agentId]/repositories/[repositoryId]/route.ts": "6c38e4b0b43aaae5c7cbad3383c5bc788e916a9a2a5f233df8713b688f3ea9a6",
    "app/api/agents/[agentId]/status/route.ts": "e30fd8c34b4469362823e844b248bf9e9a18a8c1318bf572b2ec8cd1c6668d01",
    "app/api/agents/route.ts": "d99992d5a122fe83cdc60d7145289b8c90a2022c2a44cb02cef9955e7bf5a233",
    "app/api/approvals/[approvalId]/decision/route.ts": "c092a57e60837604c4db68559d5884e6d84502e11560e5901dec92f59fd86ae4",
    "app/api/auth/login/route.ts": "7212e07f3efb82d8a7f9cafc4f8a23f4cf70558dd89731475c3d24609f5be0d5",
    "app/api/auth/logout/route.ts": "848089576bfb31b90e10d4f71de1cf96f189c7ec32f6b081d2baa01ff8901f82",
    "app/api/auth/register/route.ts": "f0e7de7138b7ca95a355bc1b0672ee781f5d1d138e2cbd37fe9718a70dab31bb",
    "app/api/auth/session/route.ts": "86efea608cb423b9e6bcdeffa5b44864a01364e7327e515e9bb1121f7eb6baf0",
    "app/api/consensus-plans/[missionId]/implementation/route.ts": "28bc88e93cbcbb9d0abaed4abb2cfa5c738cfdec30e829d99565f6194d521222",
    "app/api/consensus-plans/[missionId]/route.ts": "a9eece481cd7041c37b8fcbd7bd9af456002f252bec72f88c554ef22c4c2631f",
    "app/api/consensus-plans/route.ts": "d1b522d8514161c7ec2ecc1da7dfb388028fa99ed225e9f318cc73369a5b2736",
    "app/api/executions/[executionId]/actions/route.ts": "676fdc0893aeff5108426ed32a1f32e31027427d59f1e430ccf7f4a4ed050249",
    "app/api/executions/[executionId]/cancel/route.ts": "01c67096ceb17833719e2385a1cf5c7cefe8e91a8d9e7124d170b12354b7276f",
    "app/api/health/route.ts": "19f129c6c7db6812289f7ca0aee43b353387e3122e473e01014684781c286f5d",
    "app/api/missions/[missionId]/cancel/route.ts": "44a63338dfaf2a8a2406397288771a87cf940ed6a8a7b350779c2476007b4b04",
    "app/api/missions/[missionId]/complete/route.ts": "80e0b3d8f51ccc325b1adeafa917ffe5466fe78a335dadecebd7d95d46559719",
    "app/api/missions/[missionId]/events/route.ts": "aef88536d2c4421542ce1a6c8b17c177854fc355d5ca9ce626ea3ed509b4ad16",
    "app/api/missions/[missionId]/execution/route.ts": "51dc2158cbed71e522b49bd797c2eaf7787a60a8ecd084720930258e3bcc329f",
    "app/api/missions/[missionId]/fail/route.ts": "816d7128e4ee86e1c50b2b2c52c4c297b38b1eff2bbeca95cc9a5b5df4b647fa",
    "app/api/missions/[missionId]/pause/route.ts": "a0b68e9f71db91ae46411c44e49b33f6a92bdc58bee89a302bc518c433f65221",
    "app/api/missions/[missionId]/plan/route.ts": "dbe810f7ba24174ce4f7ac64935a2814eea2415ef6260031a03de10bd597aad7",
    "app/api/missions/[missionId]/resume/route.ts": "e533b81798bd60e817ed405f7a8fef1b98117a10ec60d80daaf6b2eba1cca479",
    "app/api/missions/[missionId]/start/route.ts": "e533b81798bd60e817ed405f7a8fef1b98117a10ec60d80daaf6b2eba1cca479",
    "app/api/missions/route.ts": "ce4b720c2cbb210ffe91a8275d430bf088c20ecaa5a2e79f57fe4c0196bb8906",
    "app/api/onboarding/connect/route.ts": "15484c1c627edf6b474eb0c25d0f7fe1a97197448fbc83e548110b9b2bd0d17b",
    "app/api/onboarding/events/route.ts": "ca048e78a5dc4e0966b3c503807ba7ba1601d880a9ae0769c3a2f367d2863531",
    "app/api/onboarding/first-mission/route.ts": "a598fe1d8059fb809baf1288cc1ee26ca07a02d508d6ef5237d60664d56191d8",
    "app/api/readiness/route.ts": "fe0dcdbe207f3f8e0efce60d413c26bd40f42ec8f8ccb1357917bd0add5e649a",
    "app/api/recommendations/[recommendationId]/change-mission/route.ts": "083e25fa43d53a6aa5cabb525d9b0827a3ddcd879957a7f34ff37b8ded0a446d",
    "app/api/recommendations/[recommendationId]/status/route.ts": "175b30ca5dfca0dde220d905fad2f95596b29457a258e400c00ddd4fad69fccc",
    "app/api/repository-identity-migrations/[migrationId]/approve/route.ts": "aa4c62b97d0bf391d4c5d4b11f43ea1ac207082a97a99720fe436dc056af63e9",
    "app/api/repository-identity-migrations/[migrationId]/rollback/route.ts": "483083dbe439e8c66b642d78090dba3100e8a319c41eb231b97a8d46ee790fd2",
    "app/api/tasks/[taskId]/claim/route.ts": "824a24c20d88ab01c5e8e7c5bf67ba4ff6c3af5cfd9bd35a15bf76fd5223e7c4",
    "app/api/tasks/[taskId]/executions/route.ts": "82a44becfaf6b986ad939d2d2a1433e18f910ef4bae219a6987de587a7c70858",
    "app/app-navigation.tsx": "201a54d93bebf5b1f3895fcfb4a1411655963a148badfdcd901e5a392221d1b1",
    "app/approvals/inbox.tsx": "6805d81e645a2efb1317f8aa697e6ee80e89bc1cc87bb2cc87404d0c5a2679cb",
    "app/approvals/page.tsx": "5c4376b0c6c25334b663268692ae1c7a970425c1f85bb3f172948c90efc1a20b",
    "app/architecture/page.tsx": "4e70cd011214c2e892c1f6a8059be0a449f51fbb3d57270a70469bcdef64f823",
    "app/artifacts/[artifactId]/page.tsx": "21c558d5b30c0e2d8365ff41e1df8f25acae9cf97491187f3c529be013c196ce",
    "app/audit/page.tsx": "408199098ddcd7a047b84e20018cb2c1911f2a76689dcdf3c3f2da97b8e1f725",
    "app/brand-assets.tsx": "4e9c2860d64cc24b6a5d4b0372de764c84780801ea10e3c6c887f62e54ae1a20",